{
  "scene_id": "indoor_room_real_003",
  "expected_up_axis": "z",
  "expected_horizontal_axis": "x",
  "room_orientation_hint": "north_wall_parallel_to_x",
  "expected_scale_hint": "meter_scale_likely",
  "expected_door_count": 1,
  "expected_window_count": 0,
  "expected_object_categories": ["floor", "wall", "table", "mug", "door", "box"],
  "expected_relations": [
    {
      "subject_category": "mug",
      "predicate": "supported-by",
      "object_category": "table"
    },
    {
      "subject_category": "box",
      "predicate": "supported-by",
      "object_category": "floor"
    }
  ],
  "traversability_labels": [
    {
      "target_category": "door",
      "should_be_accessible": true
    },
    {
      "target_category": "box",
      "should_be_accessible": false
    }
  ],
  "notes": "Scene 003 expects a non-zero scale hint mismatch potential."
}
