{
  "scene_id": "indoor_room_real_001",
  "expected_up_axis": "z",
  "expected_horizontal_axis": "x",
  "room_orientation_hint": "north_wall_parallel_to_x",
  "expected_scale_hint": "expected_unit:meter",
  "expected_door_count": 1,
  "expected_window_count": 0,
  "expected_object_categories": ["floor", "wall", "table", "mug", "door"],
  "expected_relations": [
    {
      "subject_category": "mug",
      "predicate": "supported-by",
      "object_category": "table"
    },
    {
      "subject_category": "door",
      "predicate": "attached-to",
      "object_category": "wall"
    }
  ],
  "traversability_labels": [
    {
      "target_category": "door",
      "should_be_accessible": true,
      "question": "Door should be reachable by an agent in a room scene."
    },
    {
      "target_category": "wall",
      "should_be_accessible": false
    }
  ],
  "notes": "Baseline annotation for small eval pack scene 001."
}
